32,ACM International Symposium on Computer Architecture,ISCA,CORE2013,A*,No,,,
98,Advances in Neural Information Processing Systems,NeurIPS,CORE2013,A*,No,,,
117,Annual Computer Security Applications Conference,ACSAC,CORE2013,A,No,,,
162,Asia and South Pacific Design Automation Conference,ASPDAC,CORE2013,C,No,,,
421,"Design, Automation and Test in Europe Conference",DATE,CORE2013,B,No,,,
763,Winter Conference on Applications of Computer Vision,WACV,CORE2013,A,No,,,
783,IEEE/ACM International Conference on Computer-Aided Design,ICCAD,CORE2013,A,No,,,
790,"International Conference on Trust, Security and Privacy in Computing and Communications",TrustCom,CORE2013,A,No,,,
901,International Conference on Affective Computing and Intelligent Interaction,ACII,CORE2013,C,No,,,
1090,"International Conference on the Integration of Constraint Programming, Artificial Intelligence, and Operations Research",CPAIOR,CORE2013,B,No,,,
1267,International Conference on VLSI Design,VLSID,CORE2013,C,No,,,
1825,ACM International Joint Conference on Pervasive and Ubiquitous Computing (PERVASIVE and UbiComp combined from 2013),UbiComp,CORE2013,A*,No,,,
1954,Australasian Document Computing Symposium,ADCS,CORE2013,Australasian,Yes,,,
1955,"IASTED International Conferenceon AI, Exp Sys & Neural Networks",AEN,CORE2013,C,Yes,,,
1957,IASTED International Conference on Applied Informatics,AI,CORE2013,C,Yes,,,
1958,Artificial Intelligence and Applications Conference,AIA,CORE2013,C,No,,,
1959,Australian Institute of Computer Ethics Conference,AICEC,CORE2013,Australasian,No,,,
1964,Algorithms and Experiments,ALEX,CORE2013,B,No,,,
1966,Australasian Language Techology Workshop,ALTA,CORE2013,Australasian,Yes,,,
1970,Joint Conference on Declarative Programming APPIA-GULP-PRODE,APPIA/GULP/PRODE,CORE2013,C,No,,,
1972,National Conference of the Australian Robot Association,ARA,CORE2013,Australasian,Yes,,,
1973,Australasian Remote Sensing Conference,ARSC,CORE2013,Australasian,Yes,,,
1975,IASTED International Conference on Artificial Intelligence and Soft Computing,ASC,CORE2013,C,Yes,,,
1977,IASTED International Conference on Applied Simulation and Modelling,ASM,CORE2013,C,Yes,,,
1978,National Conference of The Australian Society for Operations Research,ASOR,CORE2013,Australasian,Yes,,,
1980,Australian Joint Conference on Artificial Intelligence,AusAI,CORE2013,Australasian,Yes,,,
1981,Australian Women in IT Conference,AusWIT,CORE2013,Australasian,Yes,,,
1985,IEEE/IFAC Joint Symposium on Intelligent Control,CACSD,CORE2013,B,No,,,
1986,IASTED International Conference on Computers and Advanced Technology in Education,CATE,CORE2013,C,Yes,,,
1987,International Command and Control Research and Technology Symposium,CCRTS,CORE2013,C,No,,,
1988,"Intelligent Multimedia, Computing and Communications Technologies and Applications of the Future ",CCTAF,CORE2013,C,No,,,
1989,"IEEE Conference on Electronic Commerce Technology and Enterprise Computing, e_Commerce and e-Services ",CBI (was CEC/EEE),CORE2013,B,No,,,
1995,Annual Conference on Computer Science Logic,CSL,CORE2013,B,No,,,
1996,Design Automation Conf,DAC,CORE2013,A,No,,,
1997,Digital Audio Effects Conference,DAFX,CORE2013,B,No,,,
1999,Australian Pattern Recognition Society Conference,DICTA,CORE2013,Australasian,Yes,,,
2000,Joint DICTA & IVCNZ,DICTA/IVCNZ,CORE2013,"Australasin (missed 2013, changed 2019)",No,,,
2002,Doing IT at Melbourne,DITAM,CORE2013,L,No,,,
2006,Distributed Simulation Symposium,DSS,CORE2013,B,No,,,
2007,International Conference on Decision Support Through Knowledge Management,DSTKM,CORE2013,C,No,,,
2008,Information Systems &Technologies /SPIE Conference on Digital Video Compression Algorithms & Techniques,DVAT,CORE2013,C,No,,,
2009,International Workshop on Principles of Diagnosis,DX,CORE2013,B,No,,,
2010,IEEE Dynamic Spectrum Access Networks,DYSPAN,CORE2013,B,No,,,
2013,International Conference on Theory and Practice of Digital Libraries (was ECDL until 2010),TPDL,CORE2013,A,Yes,,,
2014,"World Conference on Educational Multimedia, Hypermedia and Telecommunications ",ED-MEDIA,CORE2013,B,No,,,
2016,Engineering Federated Information (Database) Systems,EFIS/EFDBS,CORE2013,C,Yes,,,
2017,Joint Meeting of the European Frequency and Time Forum and the Institute of Electrical and Electronics Engineers In,EFTF/IFCS,CORE2013,C,No,,,
2018,European Grid Conference,EGC,CORE2013,B,No,,,
2019,The Annual International Conference of the IEEE Engineering in Medicine and Biology Society,EMBC,CORE2013,C,No,,,
2022,International European Conference on Parallel and Distributed Computing (was International Conference on Parallel Processing),EuroPar,CORE2013,A,No,,,
2025,European Workshop on Learning Robots,EWLR,CORE2013,B,No,,,
2027,Frontiers in Education,FIE,CORE2013,B,No,,,
2029,Formal Techniques in Real-Time and Fault Tolerant Systems,FTRTFT,CORE2013,B,No,,,
2030,IEEE Global Telecommunications Conference,GLOBECOM,CORE2013,B,No,,,
2032,Human Language Technologies,HLT,CORE2013,B,No,,,
2033,Symposium on High Performance Chips,HOTCHIPS (HCS),CORE2013,A,No,,,
2035,International Conference on High Performance Computing and Networking,HPCN,CORE2013,B,No,,,
2036,IADIS International Conference Applied Computing,IADIS AC,CORE2013,C,No,,,
2037,IEEE Industry Applications Society Annual Conference,IAS,CORE2013,C,No,,,
2039,IFAC Conference on Automation,ICA,CORE2013,C,No,,,
2040,International Conference of Asian Digital Libraries,ICADL,CORE2013,A,No,,,
2041,International Conference on Artificial Neural Networks and Genetic Algorithms,ICANNGA,CORE2013,C,No,,,
2042,"IEEE International Conference on Acoustics, Speech and Signal Processing",ICASSP,CORE2013,B,No,,,
2044,International Conference on Computing and Information,ICCI,CORE2013,B,No,,,
2046,International Conference on Communication Systems and Applications,ICCSA,CORE2013,C,No,,,
2051,IEEE International Conference on Robotics and Automation,ICRA,CORE2013,B,No,,,
2052,International Computer Symposium Conference,ICSC2,CORE2013,A,No,,,
2056,"IEEE Conference on Information, Decision and Control",IDC,CORE2013,C,No,,,
2057,International Database Conference (HK CS),IDC(W),CORE2013,L,No,,,
2058,IDF Congress,IDFC,CORE2013,C,No,,,
2062,Intelligent Vehicles Conference,IEEE-IV,CORE2013,B,No,,,
2063,IEEE International Conference on Multimedia Computing and Systems,IEEE-MM,CORE2013,A,No,,,
2065,Intenational Environmental Modelling and Software Society,iEMSs,CORE2013,C,No,,,
2066,International Federation of Automatic Control World Congress,IFAC,CORE2013,C,No,,,
2068,International Joint Conference on Computational Linguistics,IJCNLP2,CORE2013,B,No,,,
2070,"IASTED International Conference on Internet, Multimedia Systems and Applications",IMSA,CORE2013,C,Yes,,,
2071,IEEE Intell Network Workshop,IN,CORE2013,B,No,,,
2072,International Conference on Applications of Prolog (no information after 2013),INAP,CORE2013,C,No,,,
2073,IEEE International Symposium on Intelligence in Neural & Biological Systems,INBS,CORE2013,B,No,,,
2074,IEEE International Conference on Computer Communications,INFOCOM,CORE2013,A*,No,,,
2076,IEEE International Conference on Intelligent Processing Systems,IPS,CORE2013,C,No,,,
2078,Information Resources Management Association International Conference,IRMA,CORE2013,B,No,,,
2080,IASTED International Conference on Intelligent Systems and Control,ISC,CORE2013,C,Yes,,,
2081,IEEE International Solid-State Circuits Conference,ISSCC,CORE2013,A,No,,,
2083,International Conference on IT Based Higher Education and Training,ITHET,CORE2013,C,No,,,
2084,IEEE International Workshop on Cluster Computing and the Grid,IWCC,CORE2013,C,No,,,
2088,IEEE LAN/MAN Workshop,LANMAN,CORE2013,C,No,,,
2089,IASTED International conference Law and Technology,LawTech,CORE2013,C,Yes,,,
2091,International Workshop on Logic Programming and Multi-Agents,LPMA,CORE2013,B,No,,,
2092,Language Resources and Evaluation Conference,LREC,CORE2013,C,No,,,
2094,Australian Conference on Mathematics and Computers in Sport,MCSpo,CORE2013,Australasian,Yes,,,
2096,"IASTED International Conference on Modelling, Identification, and Control",MIC,CORE2013,C,Yes,,,
2097,Malaysia International Conference on Communications,MICC,CORE2013,Regional,No,,,
2098,International Symposium on Microarchitecture,MICRO,CORE2013,A,No,,,
2099,IEEE International Conference on Multimedia in Education,MME,CORE2013,C,No,,,
2100,Multiple Objective Decision Support System Conference,MODSS,CORE2013,C,No,,,
2101,IASTED International Conference on Modelling and Simulation,MS,CORE2013,C,Yes,,,
2104,"Net Object Days (Includings MATES, ENASE etc.)",MATES ENASE,CORE2013,A,No,,,
2106,"Annual IASTED International Conference on Networks, Parallel and Distributed Processing and Applications",NPDP,CORE2013,C,Yes,,,
2107,Open and Distance Learning Association of Australia Bienniel Forum,ODLA,CORE2013,Australasian,Yes,,,
2108,"Joint OECC, IOCC & ACOFT",OESS/IOCC/ACOFT,CORE2013,C,No,,,
2109,International Conference on Object Oriented Information Systems,OOIS,CORE2013,C,No,,,
2111,PACES & ICIL,P&I,CORE2013,C,No,,,
2112,Post-Graduate ADFA Conference on Computer Science,PACCS,CORE2013,L,No,,,
2113,IASTED International Conference on Parallel and Distributed Computing and Networks,PDCN,CORE2013,C,Yes,,,
2114,IASTED International Conference on Parallel and Distributed Computing and Systems,PDCS,CORE2013,C,Yes,,,
2115,Joint AUPEC & EECON,PEC&CON,CORE2013,C,No,,,
2117,International Symposium on Physical Design,PHYSDES,CORE2013,C,No,,,
2118,Symposium on Programming Language Implementation and Logic Programming,PLILP,CORE2013,B,No,,,
2122,IASTED International Conference on Robotics and Manufacturing,RM,CORE2013,C,Yes,,,
2125,IASTED International Conference on Software Engineering,SE,CORE2013,C,Yes,,,
2126,IASTED International Conference on Software Engineering and Applications,SEA,CORE2013,C,Yes,,,
2130,International Conference on Software Engineering: Education and Practice,SEEP,CORE2013,B,No,,,
2131,International NZ Conference on Computer-Human Interaction,SIGCHI-NZ,CORE2013,"Australasian (missed 2013, changed 2019)",No,,,
2133,IASTED International Conference on Signal and Image Processing,SIP,CORE2013,C,Yes,,,
2134,Society for Information Technology and Teacher Education Conference,SITE,CORE2013,C,No,,,
2137,ACM Symposium on Software Reusability,SSR,CORE2013,A,No,,,
2140,Theory and Applications of Knowledge MAnagement,TAKMA,CORE2013,C,No,,,
2141,International Conference on Technology Education,TE,CORE2013,C,No,,,
2145,University of Western Australia Computer Science Research Conference,UWACS,CORE2013,Australasian,Yes,,,
2147,"IASTED International Conference on Visualization, Imaging, and Image Processing",VIIP,CORE2013,C,Yes,,,
2149,International Workshop on Artificial Intelligence and Statistics,WAIS,CORE2013,B,No,,,
2150,World Conference on Computers in Education,WCCE,CORE2013,C,No,,,
2151,World Congress on Systems Simulation,WCSS,CORE2013,B,No,,,
2152,Workshop on Distributed Algorithms (DISC since 1998),WDAG,CORE2013,B,No,,,
2154,International Computer Symposium Workshop,WICS,CORE2013,C,No,,,
2155,"World Multi-Conference on Systemics, Cybernetics and Informatics",WMSCI,CORE2013,C,No,,,
2158,"Informatics in Education (journal, congress, symposium, etc all under this name - can't rank)",,CORE2013,C,No,,,
10,ACM Annual Computer Science Conference,CSC,CORE2013,C,No,08,,
21,ACM Information Technology Education,SIGITE,CORE2013,C,No,08,,
86,ACS/IEEE International Conference on Computer Systems and Applications,AICCSA,CORE2013,C,No,08,12,
145,Applied Computing Conference,ACC,CORE2013,C,No,08,,
166,Asian Computing Science Conference,ASIAN,CORE2013,B,No,08,,
207,Australasian Computer Science Conference,ACSC,CORE2013,Australasian,Yes,08,,
336,Computer Science Research Conference,CSRC,CORE2013,C,No,08,,
380,"Conference on Software Engineering Education and Training (previously Conference is Software Engineering Education, CSEE, changed in 1997)",CSEET,CORE2013,C,No,08,09,
407,Current Trends in Theory and Practice of Computer Science,SOFSEM,CORE2013,B,No,08,,
470,European Computing Conference,ECC,CORE2013,C,No,08,,
556,Genetic and Evolutionary Computations,GECCO,CORE2013,A,No,08,09,
637,IEEE International Conference on Computer and Information Technology,CIT,CORE2013,C,No,08,,
686,IEEE International Multioptic Conference,INMIC,CORE2013,C,No,08,,
744,IEEE Symposium on Computers and Communications,ISCC,CORE2013,B,No,08,,
754,IEEE Systems and Information Engineering Design Symposium,SIEDS,CORE2013,C,No,08,,
782,IEEE/ACIS International Conference on Computer and Information Science,ICIS,CORE2013,C,No,08,,
799,IFIP Congress (Information Processing),Information Processing,CORE2013,C,No,08,,
869,International Computer Science Conference,ICSC,CORE2013,B,No,08,,
965,International Conference on Computers and their Applications,CATA,CORE2013,C,No,08,,
1036,International Conference on Frontiers of Information Technology,FIT,CORE2013,C,No,08,,
1066,International Conference on Information and Communication Technologies and Development,ICTD,CORE2013,C,No,08,,
1069,International Conference on Information and Communications Technology,ICICT,CORE2013,C,No,08,,
1070,International Conference on Information and Emerging Technologies,ICIET,CORE2013,C,No,08,,
1083,International Conference on Information Technology and Applications,ICITA,CORE2013,C,No,08,,
1084,International Conference on Information Technology Interfaces,ITI,CORE2013,C,No,08,,
1093,International Conference on Intelligent Data Engineering and Automated Learning,IDEAL,CORE2013,C,No,08,,
1103,International Conference on International and Communication Technologies,ICICTE,CORE2013,C,No,08,,
1187,International Conference on Recent Advances in Information Technology and Applications,RAITA,CORE2013,C,No,08,,
1214,"International Conference on Software Engineering, Artificial Intelligence, Networking and Parallel/Distributed Computing",SNPD,CORE2013,C,No,08,,
1316,"International Joint Conference on Knowledge Discovery, Knowledge Engineering and Knowledge Management",IC3K,CORE2013,C,No,08,10,
1387,International Symposium on Information and Communication Technologies,ISICT,CORE2013,C,No,08,,
1556,ISCA International Conference on Computer Applications in Industry and Engineering,CAINE,CORE2013,C,No,08,,
1611,Mexican International Conference on Current Trends in Computer Science (was Mexican International Conference on Computer Science),ENC,CORE2013,C,No,08,,
1705,Richard Tapia Celebration of Diversity in Computing Conference,Tapia,CORE2013,C,No,08,,
1838,Usenix Annual Technical Conference,USENIX,CORE2013,A,No,08,,
1844,USENIX Workshop on Electronic Commerce,USENIX EC,CORE2013,C,No,08,,
1940,World Computer Congress,WCC,CORE2013,C,No,08,,
1943,"World Congress in Computer Science, Computer Engineering, and Applied Computing",WORLDCOMP,CORE2013,C,No,08,,
4,3-D Digital Imaging and Modelling,3DIM,CORE2013,C,No,0801,,
38,ACM SIG International Conference on Computer Graphics and Interactive Techniques,SIGGRAPH,CORE2013,A*,No,0801,,
42,ACM SIGGRAPH/Eurographics Symposium on Computer Animation,SCA,CORE2013,B,No,0801,,
67,ACM Virtual Reality Software and Technology,VRST,CORE2013,A,Yes,0801,,
73,ACM Workshop on Secure Web Services,SWS,CORE2013,C,No,0801,,
81,ACM/SPIE Multimedia Computing and Networking,MMCN,CORE2013,A,No,0801,,
85,ACM-SIGRAPH Interactive 3D Graphics and Games,I3DG,CORE2013,A*,Yes,0801,,
89,Advanced Concepts for Intelligent Vision Systems,ACIVS,CORE2013,B,Yes,0801,,
90,Advanced Course on Artificial Intelligence,ACAI,CORE2013,C,No,0801,,
93,Advanced Visual Interfaces,AVI,CORE2013,B,No,0801,,
96,Advances in Intelligent Systems,AIS,CORE2013,C,No,0801,,
100,Agent-Oriented Information Systems Workshop,AOIS,CORE2013,B,No,0801,,
110,Ambient Intelligence Developments,Aml.d,CORE2013,C,No,0801,,
120,Annual Conference of the Cognitive Science Society,CogSci,CORE2013,A,No,0801,,
123,Annual Conference of the International Speech Communication Association (was Eurospeech),Interspeech,CORE2013,A,No,0801,,
124,Annual Conference on Computational Learning Theory,COLT,CORE2013,A*,No,0801,,
125,Annual Conference on Evolutionary Programming,EP,CORE2013,C,No,0801,,
132,Annual International Workshop on Presence,ISPR,CORE2013,B,No,0801,,
143,Applications of Information Visualization,IV-App,CORE2013,C,No,0801,,
146,Applied Perception in Graphics and Visualization,APGV,CORE2013,C,No,0801,,
148,Argentine Symposium on Artificial Intelligence,ASAI,CORE2013,C,No,0801,,
149,Artificial Intelligence in Knowledge Management,AIKM,CORE2013,C,No,0801,,
150,Artificial Intelligence in Medicine,AIIM,CORE2013,A,No,0801,,
151,Artificial Intelligence in Medicine in Europe,AIME,CORE2013,A,Yes,0801,,
152,Artificial Neural Networks in Engineering Conference,ANNIE,CORE2013,B,No,0801,,
167,Asian Conference on Computer Vision,ACCV,CORE2013,B,No,0801,,
177,Asia-Pacific Conference on Complex Systems,Complex,CORE2013,C,No,0801,,
181,Asia-Pacific Conference on Simulated Evolution and Learning,SEAL,CORE2013,B,No,0801,,
196,Association of Computational Linguistics,ACL,CORE2013,A*,No,0801,,
203,Australasian Cognitive Science Society Conference,AuCSS,CORE2013,Australasian,Yes,0801,,
216,Australasian Conference on Robotics and Automation,ACRA,CORE2013,Australasian,Yes,0801,,
224,Australasian Joint Conference on Artificial Intelligence,AI,CORE2013,Australasian,Yes,0801,,
229,Australasian Speech Science and Technology,SST,CORE2013,Australasian,Yes,0801,,
240,Asia Pacific Symposium on Intelligent and Evolutionary Systems (was Australia-Japan Joint Workshop on  Intelligent and Evolutionary Systems),IES,CORE2013,C,Yes,0801,,
248,Australian Conference for Knowledge Management and Intelligent Decision Support,ACKMIDS,CORE2013,Australasian,Yes,0801,,
249,Australian Conference on Artificial Life and Computational Intelligence,ACALCI,CORE2013,Australasian,Yes,0801,,
251,Australian Conference on Neural Networks,ACNN,CORE2013,Australasian,Yes,0801,,
262,Australian Knowledge Acquisition Workshop,AKAW,CORE2013,Australasian,Yes,0801,,
263,Australian MADYMO Users Meeting,MADYMO,CORE2013,Australasian,Yes,0801,,
268,Australian Symposium on Information Visualisation,ASIV,CORE2013,Australasian,Yes,0801,,
285,Bioinformatics Visualization,BioViz,CORE2013,C,No,0801,,
323,Complex Objects Visualization Workshop,COV,CORE2013,C,No,0801,,
333,"Computer Animation, Information Visualisation, and Digital Effects",CAivDE,CORE2013,C,No,0801,,
335,Computer Graphics International,CGI,CORE2013,B,No,0801,,
346,Conference in Uncertainty in Artificial Intelligence,UAI,CORE2013,A*,Yes,0801,,
348,Conference of the Association for Machine Translation in the Americas,AMTA,CORE2013,B,No,0801,,
352,Conference of the European Association for Machine Translation,EAMT,CORE2013,B,No,0801,,
353,Conference of the International Society for Decision Support Systems,ISDSS,CORE2013,C,No,0801,,
354,Conference of the Pacific Association for Computational Linguistics,PACLING,CORE2013,B,No,0801,,
359,Conference on Artificial Intelligence for Applications,CAIA,CORE2013,B,No,0801,,
360,Conference on Artificial Neural Networks and Expert systems,ANNES,CORE2013,C,No,0801,,
371,Conference on Computational Natural Language Learning,CoNLL,CORE2013,A,No,0801,,
385,Conference on Visualization and Data Analysis,VDA,CORE2013,C,No,0801,,
398,"Cooperative Design, Visualization, and Engineering",CDVE,CORE2013,C,No,0801,,
400,Coordinated and Multiple Views in Exploratory Visualization,CMV,CORE2013,C,No,0801,,
405,Cultural Heritage Knowledge Visualisation,CHKV,CORE2013,C,No,0801,,
414,Design and Aesthetics in Visualisation,DAViz,CORE2013,C,No,0801,,
428,Digital Image Computing Techniques and Applications,DICTA,CORE2013,B,No,0801,,
430,Discourse Anaphora and Anaphor Resolution Colloquium,DAARC,CORE2013,C,No,0801,,
448,Empirical Methods in Natural Language Processing,EMNLP,CORE2013,A,No,0801,,
452,ENVI and IDL Data Analysis and Visualization Symposium,VISualize,CORE2013,C,No,0801,,
458,Euro Virtual Reality,Euro VR,CORE2013,C,No,0801,,
460,Eurographics Symposium on Parallel Graphics and Visualization,EGPGV,CORE2013,B,No,0801,,
462,Eurographics/IEEE Symposium on Visualization,EuroVis,CORE2013,B,No,0801,,
468,European Association of Computational Linguistics,EACL,CORE2013,A,No,0801,,
472,European Conference on Ambient Intelligence,AmI,CORE2013,C,No,0801,,
473,European Conference on Artificial Intelligence,ECAI,CORE2013,A,No,0801,,
474,European Conference on Artificial Life,ECAL,CORE2013,B,No,0801,,
476,European Conference on Computational Learning Theory (Now in COLT),EuroCOLT,CORE2013,C,No,0801,,
479,European Conference on Computer Vision,ECCV,CORE2013,A,No,0801,,
481,European Conference on Genetic Programming,EUROGP,CORE2013,B,No,0801,,
486,European Conference on Machine Learning (Joined with PKDD from 2008),ECML,CORE2013,A,No,0801,,
494,Interspeech (combined EuroSpeech and ICSLP in 2000),Interspeech,CORE2013,A,No,0801,,
495,European Conference on Symbolic and Quantitative Approaches to Reasoning with Uncertainty,ECSQARU,CORE2013,C,No,0801,,
498,European Congress on Intelligent Techniques and Soft Computing,EUFIT,CORE2013,C,No,0801,,
499,European Graphics Conference,EUROGRAPH,CORE2013,A,No,0801,,
508,European Simulation Symposium,ESS,CORE2013,B,No,0801,,
512,European Symposium on Artificial Neural Networks,ESANN,CORE2013,B,No,0801,,
520,European Workshop on Modelling Autonomous Agents in a Multi-Agent World,MAAMAW,CORE2013,C,No,0801,,
521,European Workshop on Multi-Agent Systems,EUMAS,CORE2013,C,No,0801,,
534,Finite Differences-Finite Elements-Finite Volumes-Boundary Elements,F-and-B,CORE2013,C,No,0801,,
537,Flexible Query-Answering Systems,FQAS,CORE2013,C,No,0801,,
546,Foundations of Genetic Algorithms,FOGA,CORE2013,A*,No,0801,,
562,GeoVisualization and Information Visualization,GeoViz,CORE2013,C,No,0801,,
573,Graphics Interface,GI,CORE2013,B,No,0801,,
592,IberoAmerican Congress on Pattern Recognition,CIARP,CORE2013,C,Yes,0801,,
595,IEEE Automatic Speech Recognition and Understanding Workshop,ASRU,CORE2013,C,No,0801,,
604,IEEE Conference on Computer Vision and Pattern Recognition,CVPR,CORE2013,A,Yes,0801,,
623,IEEE Information Visualization Conference,IEEE InfoVis,CORE2013,A*,No,0801,0806,
627,IEEE International Conference on Adaptive and Intelligent Systems,ICAIS,CORE2013,C,No,0801,,
629,IEEE International Conference on Automatic Face and Gesture Recognition,FG,CORE2013,C,No,0801,,
633,IEEE International Conference on Cognitive Informatics,ICCI,CORE2013,C,No,0801,,
635,IEEE International Conference on Computational Cybernetics,ICCC,CORE2013,C,No,0801,,
636,IEEE International Conference on Computational Intelligence for Measurement Systems and Applications,CIMSA,CORE2013,C,No,0801,,
638,IEEE International Conference on Computer Vision,ICCV,CORE2013,A*,Yes,0801,,
641,IEEE International Conference on Cybernetics and Intelligent Systems,CIS,CORE2013,C,No,0801,,
649,IEEE International Conference on Fuzzy Systems,FUZZ-IEEE,CORE2013,A,No,0801,,
651,IEEE International Conference on Granular Computing,GrC,CORE2013,C,No,0801,,
654,IEEE International Conference on Image Processing,ICIP,CORE2013,B,No,0801,,
656,IEEE International Conference on Information and Automation,IEEE ICIA,CORE2013,C,No,0801,,
659,IEEE International Conference on Intelligence for Homeland Security and Personal Safety,CIHSPS,CORE2013,C,No,0801,,
660,IEEE International Conference on Intelligent Computer Communication and Processing,ICCP,CORE2013,C,No,0801,,
661,IEEE International Conference on Intelligent Systems,IEEE IS,CORE2013,C,No,0801,,
664,IEEE International Conference on Multimedia and Expo,ICME,CORE2013,B,No,0801,,
666,IEEE International Conference on Neural Networks,ICNN,CORE2013,B,No,0801,,
683,IEEE International Geoscience and Remote Sensing Symposium,IGARSS,CORE2013,C,No,0801,,
685,IEEE International Joint Conference on Neural Networks,IJCNN,CORE2013,A,No,0801,,
693,IEEE International Symposium on Artificial Life,IEEE Alife,CORE2013,A,No,0801,,
701,IEEE International Symposium on Multimedia,ISM,CORE2013,C,No,0801,,
712,IEEE International Workshop on Cellular Nanoscale Networks and Applications,CNNA,CORE2013,C,No,0801,,
715,IEEE International Workshop on Neural Networks for Signal Processing,NNSP,CORE2013,C,No,0801,,
720,IEEE International Working Conference on Software Visualisation,VISSOFT,CORE2013,B,No,0801,,
724,IEEE Pacific Visualization Symposium (was APVIS),PacificVis,CORE2013,B,Yes,0801,,
727,IEEE Swarm Intelligence Symposium,IEEE SIS,CORE2013,C,No,0801,,
728,IEEE Symposium on 3D User Interfaces,3DUI,CORE2013,B,No,0801,,
731,IEEE Symposium on Computational Intelligence and Data Mining,CIDM,CORE2013,C,No,0801,0804,
732,Conference on Games (was Computational Intelligence and Games CIG),COG,CORE2013,C,No,0801,,
733,IEEE Symposium on Computational Intelligence for Financial Engineering,IEEE CIFEr,CORE2013,C,No,0801,,
734,IEEE Symposium on Computational intelligence for Image Processing,IEEE CIIP,CORE2013,C,No,0801,,
735,IEEE Symposium on Computational intelligence for Multimedia Signal and Vision Processing,IEEE CIMSIVP,CORE2013,C,No,0801,,
736,IEEE Symposium on Computational Intelligence for Security and Defence Applications,IEEE CISDA,CORE2013,C,No,0801,,
737,IEEE Symposium on Computational Intelligence in Bioinformatics and Computational Biology,CIBCB,CORE2013,C,No,0801,,
738,IEEE Symposium on Computational Intelligence in Control and Automation,IEEE CICA,CORE2013,C,No,0801,,
739,IEEE Symposium on Computational Intelligence in Cyber Security,IEEE CICS,CORE2013,C,No,0801,0805,
740,IEEE Symposium on Computational Intelligence in Image and Signal Processing,CIISP,CORE2013,C,No,0801,,
741,IEEE Symposium on Computational Intelligence in Multi-Criteria Decision-Making,IEEE MCDM,CORE2013,C,No,0801,,
