559,Geometry Festival: An international workshop on Discrete Geometry and Rigidity,GeomFest,CORE2013,C,No,0802,,
560,Geometry Modeling and Processing,GMP,CORE2013,B,No,0802,,
572,Graph Drawing,GD,CORE2013,A,No,0802,,
590,IAVoSS Workshop On Trustworthy Elections,WOTE,CORE2013,C,No,0802,,
602,IEEE Conference on Computational Complexity,CCC,CORE2013,B,Yes,0802,,
622,"IEEE Information Theory Workshop on Detection, Estimation, Classification and Imaging",DECI,CORE2013,C,No,0802,,
692,IEEE International Symposium on Adaptive Dynamic Programming and Reinforcement Learning,IEEE ADPRL,CORE2013,C,No,0802,,
745,IEEE Symposium on Foundations of Computer Science,FOCS,CORE2013,A*,No,0802,,
748,IEEE Symposium on Logic in Computer Science,LICS,CORE2013,A*,No,0802,,
750,IEEE Symposium on Security and Privacy,SP,CORE2013,A,Yes,0802,0803,
751,IEEE Symposium on Visual Analytics Science and Technology,IEEE VAST,CORE2013,C,No,0802,,
762,IEEE Workshop on Advances in Techniques for Analysis of Remotely Sensed Data,WARDS,CORE2013,C,No,0802,,
803,IFIP International Conference on Theoretical Computer Science,IFIP TCS,CORE2013,C,No,0802,,
819,Inductive Logic Programming,ILP,CORE2013,B,No,0802,,
839,Int. Workshop on Formal Methods for Industrial Critical Systems,FMICS,CORE2013,C,No,0802,,
842,Integrated Formal Methods,IFM,CORE2013,B,No,0802,,
856,International and Interdisciplinary Conference on Modelling and Using Context,CONTEXT,CORE2013,C,No,0802,,
864,International Colloquium on Automata Languages and Programming,ICALP,CORE2013,A,No,0802,,
866,International Colloquium on Structural Information and Communication Complexity,SIROCCO,CORE2013,B,No,0802,,
867,International Colloquium on Theoretical Aspects of Computing,ICTAC,CORE2013,B,No,0802,,
870,International Computer Science Symposium in Russia,CSR,CORE2013,C,No,0802,,
904,International Conference on Algebraic and Logic Programming,ALP,CORE2013,B,No,0802,,
906,International Conference on Algorithms and Complexity (was Italian Conference ),CIAC,CORE2013,C,No,0802,,
941,International Conference on Computability and Complexity in Analysis,CCA,CORE2013,C,No,0802,,
943,International Conference on Computational Engineering Science,ICES,CORE2013,C,No,0802,,
950,International Conference on Computational Molecular Biology,RECOMB,CORE2013,B,No,0802,,
952,International Conference on Computational Science,ICCS,CORE2013,A,Yes,0802,,
953,International Conference on Computational Science and Applications,ICCSA,CORE2013,C,No,0802,,
969,International Conference on Computing and Combinatorics,COCOON,CORE2013,A,No,0802,,
972,International Conference on Conceptual Structures,ICCS,CORE2013,B,No,0802,,
973,International Conference on Concurrency Theory,CONCUR,CORE2013,A,No,0802,,
985,International Conference on Cyberworlds (was International Symposium on Cyberworlds),CW,CORE2013,B,No,0802,,
990,International Conference on Declarative Programming and Knowledge Management (no information after 2013),INAP,CORE2013,C,No,0802,,
998,International Conference on Discrete Geometry for Computer Imagery,DGCI,CORE2013,C,No,0802,,
999,International Conference on Discrete Mathematics and Theoretical Computer Science,DMTCS,CORE2013,B,No,0802,,
1025,International Conference on Experimental Implementation of Quantum Computation,QuantCom,CORE2013,C,No,0802,,
1042,International Conference on Graph Transformations,ICGT,CORE2013,B,No,0802,,
1072,International Conference on Information Fusion,FUSION,CORE2013,C,No,0802,,
1115,International Conference on Language and Automata Theory and Applications,LATA,CORE2013,C,No,0802,,
1119,International Conference on Logic Programming,ICLP,CORE2013,A,No,0802,,
1120,International Conference on Logic Programming and Non-monotonic Reasoning,LPNMR,CORE2013,A,No,0802,,
1160,International Conference on Optimization: Techniques And Applications,ICOTA,CORE2013,C,No,0802,,
1179,"International Conference on Probability, Statistics and Operational Research",PSOR,CORE2013,C,No,0802,,
1189,International Conference on Relational and AlgebraicMethods in Computer Science (was International Conference on Relational Methods in Computer Science RelMiCS),RAMiCS,CORE2013,C,No,0802,,
1190,"International Conference on Relations, Orders and Graphs: Interaction with Computer Science",ROGICS,CORE2013,C,No,0802,,
1203,International Conference on Sequences and their Applications,SETA,CORE2013,B,No,0802,,
1235,International Conference on Temporal Logic,ICTL,CORE2013,A,No,0802,,
1237,International Conference on the Application and Theory of Petri Nets and Concurrency,ICATPN,CORE2013,B,No,0802,,
1245,"Conference on Interactive Theorem Proving (previously TPHOLs, changed in 2009)",ITP,CORE2013,A,No,0802,,
1246,International Conference on Theorem Proving with Analytic Tableaux and Related Methods,TABLEAUX,CORE2013,A,No,0802,,
1247,International Conference on Theoretical and Mathematical Foundations of Computer Science,TMFCS,CORE2013,C,No,0802,,
1249,International Conference on Theory and Applications of Computational Science,TACS,CORE2013,C,No,0802,,
1250,International Conference on Theory and Applications of Satisfiability Testing,SAT,CORE2013,A,No,0802,,
1255,International Conference on Unconventional Computation and Natural Computation (was International Conference on Unconventional Computation),UC,CORE2013,C,No,0802,,
1284,International Congress of Chinese Mathematicians,ICCM,CORE2013,C,No,0802,,
1286,International Congress of Mathematicians,ICM,CORE2013,C,No,0802,,
1288,International Congress on Computational and Applied Mathematics,ICCAM,CORE2013,C,No,0802,,
1296,International CSI Computer Conference,CSICC,CORE2013,C,No,0802,,
1301,International French Speaking Conference on Logic and Constraint Programming,JFPLC,CORE2013,C,No,0802,,
1302,International Frontiers of Algorithmics Workshop,FAW,CORE2013,B,No,0802,,
1329,International Network Optimization Conference,INOC,CORE2013,C,No,0802,,
1348,International Symposium on Algorithmic Game Theory,SAGT,CORE2013,B,No,0802,,
1349,International Symposium on Algorithms and Computation,ISAAC,CORE2013,A,Yes,0802,,
1351,"International Symposium on Applied Algebra, Algebraic Algorithms and Error-Correcting Codes",AAAAECC,CORE2013,B,No,0802,,
1364,International Symposium on Combinatorial Optimisation,ISCO,CORE2013,C,No,0802,,
1378,International Symposium on Experimental Algorithms,SEA,CORE2013,B,No,0802,,
1382,International Symposium on Functional and Logic Programming,FLOPS,CORE2013,A,No,0802,,
1383,International Symposium on Fundamentals of Computation Theory,FCT,CORE2013,A,No,0802,,
1395,International Symposium on Latin American Theoretical Informatics,LATIN,CORE2013,B,No,0802,,
1396,"International Symposium on Leveraging Applications of Formal Methods, Verification and Validation",ISoLA,CORE2013,C,No,0802,,
1397,International Symposium on Logic-based Program Synthesis and Transformation,LOPSTR,CORE2013,B,No,0802,,
1398,International Symposium on Mathematical Foundations of Computer Science,MFCS,CORE2013,A,Yes,0802,,
1420,International Symposium on Symbolic and Algebraic Computation,ISSAC,CORE2013,A*,No,0802,,
1421,International Symposium on Symbolic and Numeric Algorithms for Scientific Computing,SYNASC,CORE2013,C,No,0802,,
1424,International Symposium on Temporal Representation and Reasoning,TIME,CORE2013,A,Yes,0802,,
1426,International Symposium on Theoretical Aspects of Computer Science,STACS,CORE2013,B,Yes,0802,,
1430,International Symposium on Voronoi diagrams in Science and Engineering,ISVD,CORE2013,C,No,0802,,
1444,International Workshop on Abstract State Machines,ASM(W),CORE2013,C,No,0802,,
1448,International Workshop on Algorithms and Computation,WALCOM,CORE2013,C,No,0802,,
1451,International Workshop on Approximation Algorithms for Combinatorial Optimization Problems,APPROX,CORE2013,A,Yes,0802,,
1459,International Workshop on Combinatorial Algorithm,IWOCA,CORE2013,B,No,0802,,
1460,International Workshop on Combinatorial Image Analysis: Theory and Applications,IWCIA,CORE2013,C,No,0802,,
1465,International Workshop on Developments in Computational Models,DCM,CORE2013,C,No,0802,,
1466,International Workshop on Digital Watermarking,IWDW,CORE2013,C,No,0802,0804,
1470,International Workshop on Efficient Algorithms,WEA,CORE2013,B,No,0802,,
1477,International Workshop on Formal Methods for Parallel Programming: Theory and Applications,FMPPTA,CORE2013,C,No,0802,,
1481,International Workshop on Functional and (Constraint) Logic Programming,WFLP,CORE2013,C,No,0802,,
1483,International Workshop on Global Optimization,GO,CORE2013,C,No,0802,,
1484,International Workshop on Graph-Theoretic Concepts in Computer Science,WG,CORE2013,A,Yes,0802,,
1499,International Workshop on Logic and Complexity in Computer Science,LCCS,CORE2013,C,No,0802,,
1510,International Symposium on Parameterized and Exact Computation (was IWPEC pre 2004),IPEC,CORE2013,B,No,0802,,
1518,International Workshop on Randomization and Computation,RANDOM,CORE2013,A,No,0802,,
1520,International Workshop on Requirements Engineering Visualization,REV,CORE2013,B,No,0802,,
1536,International Workshop on the Algorithmic Foundations of Robotics,WAFR,CORE2013,C,No,0802,,
1547,International Workshops on First-Order Theorem Proving,FTP,CORE2013,B,No,0802,,
1587,Kyoto International Conference on Computational Geometry and Graph Theory,KyotoCGGT,CORE2013,C,No,0802,,
1596,Logic Programming and Automated Reasoning,LPAR,CORE2013,A,No,0802,,
1597,Logical Foundations of Computer Science,LFCS,CORE2013,B,No,0802,,
1598,"Logics in Artificial Intelligence, European Conference",JELIA,CORE2013,A,No,0802,,
1601,MACIS: International Conference of Mathematical Aspects of Computer and Information Sciences,MACIS,CORE2013,C,No,0802,,
1604,Mathematical Methods in Computer Science,MMICS,CORE2013,C,No,0802,,
1605,Mathematics of Program Construction,MPC,CORE2013,B,No,0802,,
1618,Modelling and Optimization: Theory and Applications,MOPTA,CORE2013,C,No,0802,,
1621,MSRI Combinatorial Game Theory Research Workshop,GameTheory,CORE2013,C,No,0802,,
1654,Optimal Discrete Structures and Algorithms,ODSA,CORE2013,C,No,0802,,
1655,Optimization: Techniques And Applications,OTA,CORE2013,C,No,0802,,
1664,Pacific Rim Knowledge Acquisition Workshop,PKAW,CORE2013,B,No,0802,,
1687,Practical Aspects of PROLOG/Constraint Technology,PAP/PACT,CORE2013,C,No,0802,,
1688,Practice and Theory of Automated Timetabling,PATAT,CORE2013,B,No,0802,,
1717,"Search: Workshop on Search, Sorting and Coding",Search,CORE2013,C,No,0802,,
1724,SIAM Conference on Discrete Mathematics,DM,CORE2013,C,No,0802,,
1725,SIAM Conference on Geometric Design,GeoD,CORE2013,C,No,0802,,
1726,SIAM Conference on Optimization,OP,CORE2013,C,No,0802,,
1728,"SIAM Workshop on Algorithms for Listing, Counting, and Enumeration",ALICE,CORE2013,C,No,0802,,
1732,SIGOPT - International Conference on Optimization,ICO,CORE2013,C,No,0802,,
1746,South African International Graph Theory Conference,SAIGTC,CORE2013,C,No,0802,,
1747,"Southeastern International Conference on Combinatorics, Graph Theory, and Computing",,CORE2013,C,No,0802,,
1763,Static Analysis Symposium,SAS,CORE2013,A,Yes,0802,,
1764,Stochastic Local Search Algorithms,SLS,CORE2013,C,No,0802,,
1766,Structural and Syntactical Pattern Recognition,SSPR,CORE2013,A,No,0802,,
1772,Symposium of Asian Association for Algorithms and Computation,AAAC,CORE2013,C,No,0802,,
1774,"Symposium on Abstraction, Reformulation and Approximation",SARA,CORE2013,B,No,0802,,
1775,"ACM Symposium on Access Control Models and Technologies (previously ACM Workshop on Role-Based Access Control, RBAC, changed in 2000)",SACMAT,CORE2013,C,No,0802,,
1779,Symposium on Cellular Automata,JAC,CORE2013,C,No,0802,,
1780,"Symposium On Combinatorics, Algorithms, Probabilistic and Experimental Methodologies",ESCAPE,CORE2013,C,No,0802,,
1781,Symposium on Computational Geometry for Mechanics and Applications,SOCGMA,CORE2013,C,No,0802,,
1783,Symposium on Discrete Mathematics,EDM,CORE2013,C,No,0802,,
1784,Symposium on Geometry Processing,SGP,CORE2013,B,No,0802,,
1791,Symposium on Programs as Data Objects,PADO,CORE2013,C,No,0802,,
1795,"Symposium on Stochastic Algorithms, Foundations and Applications",SAGA,CORE2013,C,No,0802,,
1797,TAI: Algorithmic Information Theory: Kolmogorov Complexity,TAI,CORE2013,C,No,0802,,
1799,Techniques and Problems in Graph Theory,TPGT,CORE2013,C,No,0802,,
1808,The International Workshop on Algorithms and Graphs,IWAAG,CORE2013,C,No,0802,,
1809,The Modelling and Simulation Society of Australia and New Zealand Meeting,ANZMODS,CORE2013,Australasian,Yes,0802,,
1814,Theoretical Aspects of Rationality and Knowledge,TARK,CORE2013,A,No,0802,,
1819,Topological and Geometric Graph Theory,TGGT,CORE2013,C,No,0802,,
1830,Unconventional Models of Computation,UMC,CORE2013,B,No,0802,,
1834,"Machines, Computations and Universality (was Universal Machines and Computations)",MCU,CORE2013,B,No,0802,,
1869,Workshop on Algorithm Engineering,WAE,CORE2013,B,No,0802,,
1870,Workshop on Algorithm Engineering and Experiments,ALENEX,CORE2013,A,No,0802,,
1871,"Workshop on Algorithmic Approaches for Transportation Modelling, Optimization, and Systems",ATMOS,CORE2013,C,No,0802,,
1872,Workshop on Algorithmic Aspects of Advanced Programming Languages,WAAAPL,CORE2013,C,No,0802,,
1873,Workshop on Algorithms And Models For The Web Graph,WAW,CORE2013,C,No,0802,,
1874,Workshop on Algorithms in Bioinformatics,WABI,CORE2013,B,No,0802,,
1875,"Workshop on Algorithms, Combinatorics, and Geometry",ACG,CORE2013,C,No,0802,,
1876,Workshop on Analytic Algorithmics and Combinatorics,ANALCO,CORE2013,B,No,0802,,
1878,Workshop on Applications of Graph Theory in Wireless Ad hoc Networks and Sensor Networks,Graph-hoc,CORE2013,C,No,0802,,
1879,Workshop on Approximation and Online Algorithms,WAOA,CORE2013,B,No,0802,,
1880,Workshop on Approximation and Randomization Algorithms in Communication Networks,ARACNE,CORE2013,C,No,0802,,
1886,Workshop on Combinatorial and Algorithmic Aspects of Networking,CAAN,CORE2013,B,No,0802,,
1888,Workshop on Computational and Conformal Geometry,CCG,CORE2013,C,No,0802,,
1889,Workshop on Computational Geometry and Applications,CGA,CORE2013,C,No,0802,,
1890,Workshop on Computational Graph Theory and Combinatorics,WCGTC,CORE2013,C,No,0802,,
1891,Workshop on Computational Optimization,WCO,CORE2013,C,No,0802,,
1893,Workshop on Constraint Satisfaction for Planning and Scheduling,COPLAS,CORE2013,B,No,0802,,
1899,Workshop on Distributed Data and Structures,WDAS,CORE2013,C,No,0802,0804,
1910,Workshop on Localized Algorithms and Protocols for Wireless Sensor Networks,LOCALGOS,CORE2013,C,No,0802,,
1911,Workshop on Logic and Learning,L&L,CORE2013,C,No,0802,,
1912,"Workshop on Logic, Language, Information and Computation",WoLLIC,CORE2013,B,No,0802,,
1913,Workshop on Massive Data Algorithmics,Massive,CORE2013,C,No,0802,,
1921,Workshop on On-Line Algorithms,OLA,CORE2013,C,No,0802,,
1923,Workshop on Parameterized Complexity,WPC,CORE2013,C,No,0802,,
1924,Workshop on Physics and Computation,PC,CORE2013,C,No,0802,,
1926,Workshop on Probabilistic Graph Theory,PGT,CORE2013,C,No,0802,,
1928,Workshop on Quantum Information Processing,QIP,CORE2013,C,No,0802,,
1936,Workshop on the Arithmetic of Finite Fields,WAIFI,CORE2013,C,No,0802,,
1938,Workshop on Uncertainty in Geometric Computations,GEOM Uncertainty,CORE2013,C,No,0802,,
2123,International Conference on Rewriting Techniques and Applications (now merged with FSCD Formal Structures for Computation and Deduction),RTA,CORE2013,A,No,0802,,
9,"ACIS Conference on Software Engineering Research, Management and Applications",SERA,CORE2013,C,No,0803,,
11,"ACM Conference on Applications, Technologies, Architectures, and Protocols for Computer Communication",SIGCOMM,CORE2013,A*,No,0803,,
12,ACM Conference on Computer and Communications Security,CCS,CORE2013,A*,Yes,0803,,
18,ACM Conference on Object Oriented Programming Systems Languages and Applications,OOPSLA,CORE2013,A*,Yes,0803,,
20,ACM Digital Rights Management Workshop,DRM,CORE2013,C,No,0803,,
37,ACM Multimedia,ACMMM,CORE2013,A*,No,0803,1203,
48,ACM SIGOPS Symposium on Operating Systems Principles,SOSP,CORE2013,A*,No,0803,,
50,ACM SIGPLAN Workshop on Partial Evaluation and Program Manipulation,PEPM,CORE2013,B,No,0803,,
51,ACM SIGPLAN Workshop on Types in Language Design and Implementation (was TIC),TLDI,CORE2013,C,No,0803,,
52,"European Software Engineering Conference and the ACM SIGSOFT Symposium on the Foundations of Software Engineering (duplicate was listed as ESEC, removed from DB)",ESEC/FSE,CORE2013,A,Yes,0803,,
53,ACM SIGSOFT Workshop on Program Analysis for Software Tools and Engineering,PASTE,CORE2013,B,No,0803,,
61,"Asia Conference on Information, Computer and Communications Security",AsiaCCS,CORE2013,B,No,0803,,
68,ACM Workshop on Formal Methods in Security Engineering: From Specifications to Code,FMSE,CORE2013,C,No,0803,,
70,ACM Workshop on Hot Topics in Software Upgrades,HotSWUp,CORE2013,C,No,0803,,
72,ACM Workshop on Scalable Trusted Computing,STC,CORE2013,B,No,0803,,
75,ACM/IEEE International Conference on Distributed Smart Cameras,ICDSC,CORE2013,B,No,0803,,
79,ACM/IFIP/USENIX International Middleware Conference,Middleware,CORE2013,A,No,0803,,
82,ACM-SIGACT Symposium on Principles of Programming Languages,POPL,CORE2013,A*,No,0803,,
84,ACM-SIGPLAN Conference on Programming Language Design and Implementation,PLDI,CORE2013,A*,No,0803,,
131,Annual International Conference on Ada,TRI-Ada,CORE2013,C,No,0803,,
134,Annual PKI R&D Workshop,PKI,CORE2013,C,No,0803,,
147,Architectural Support for Programming Languages and Operating Systems,ASPLOS,CORE2013,A*,No,0803,,
171,ASIAN Symposium on Programming Languages and Systems,APLAS,CORE2013,B,Yes,0803,,
175,Asia-Pacific Bioinformatics Conference,APBC,CORE2013,B,No,0803,,
186,Asia-Pacific Software Engineering Conference,APSEC,CORE2013,C,Yes,0803,,
190,Aspect-Orientation Asia,AO-Asia,CORE2013,C,No,0803,,
191,Aspect-Oriented Software Development,AOSD,CORE2013,A,No,0803,,
193,Association for Computer-Aided Architectural Design Research in Asia (CAADRIA) annual conference,CAADRIA,CORE2013,B,No,0803,1203,1201
204,Australasian Compumod Users' Conference,COMPUMOD,CORE2013,Australasian,Yes,0803,,
205,Australasian Computer Architecture Conference,ACAC,CORE2013,Australasian,Yes,0803,,
208,Australasian Computer Systems Architecture Conference (now Asia-Pacific Computer Systems Architecture Conference),ACSAC,CORE2013,Australasian,Yes,0803,,
215,Australasian Conference on Pattern Languages of Programs,KoalaPLoP,CORE2013,Australasian,Yes,0803,,
223,Australasian Information Security Workshop 2007 (Privacy Enhancing Technologies),AISW-PET,CORE2013,Australasian,Yes,0803,,
226,Australasian Refinement Workshop,AuRW,CORE2013,Australasian,Yes,0803,,
252,Australian Conference on Software Metrics,ACOSM,CORE2013,Australasian,Yes,0803,,
266,Australian Software Engineering Conference,ASWEC,CORE2013,Australasian,Yes,0803,,
271,Australian UNIX Users Group National Conference,AUUG,CORE2013,Australasian,Yes,0803,,
275,Australian Workshop on Requirements Engineering,AWRE,CORE2013,Australasian,Yes,0803,0806,
277,Australian Workshop on Software Architecture,AWSA,CORE2013,Australasian,Yes,0803,,
279,Automated Software Engineering Conference,ASE,CORE2013,A,Yes,0803,,
324,Complexity and information-theoretic approaches to biology,CITB,CORE2013,B,No,0803,,
327,Computational Intelligence in Security for Information Systems,CISIS,CORE2013,B,No,0803,,
355,Conference on Agile Software Development,XP,CORE2013,B,No,0803,,
362,"Conference on Computers, Freedom, and Privacy",CFP,CORE2013,C,No,0803,,
377,Conference on RFID Security,RFIDSec,CORE2013,C,No,0803,,
378,Conference on Security and Cryptography for Networks,SCN,CORE2013,B,No,0803,,
379,Conference on Security in Network Architectures and Information Systems,SAR-SSI,CORE2013,C,No,0803,,
383,Conference on the Quality of Software Architectures,QoSA,CORE2013,A,Yes,0803,,
434,Domain - Specific Languages for Software Engineering,DSLSE,CORE2013,C,No,0803,,
435,Domain Specific Aspect Languages,DSAL,CORE2013,C,No,0803,,
439,Dynamic Languages Symposium,DLS,CORE2013,B,No,0803,,
464,Euromicro Conference on Software Engineering and Advanced Applications,SEAA,CORE2013,C,No,0803,,
475,European Conference on Computational Biology,ECCB,CORE2013,B,No,0803,,
488,European Conference on Object-Oriented Programming,ECOOP,CORE2013,A,Yes,0803,,
490,European Conference on Pattern Languages of Programs,EuroPLop,CORE2013,B,No,0803,,
493,European Conference on Software Maintenance and Reengineering,CSMR,CORE2013,C,No,0803,,
501,European Lisp Workshop,ELW,CORE2013,C,No,0803,,
504,European PKI Workshop: Theory and Practice,EUROPKI,CORE2013,B,No,0803,,
514,European Symposium on Programming,ESOP,CORE2013,A,No,0803,,
515,European Symposium On Research In Computer Security,ESORICS,CORE2013,A,No,0803,,
522,European Workshop on Security and Privacy in Ad -Hoc and Sensor Networks,ESAS,CORE2013,C,No,0803,,
525,Eurosys Conference,EuroSys,CORE2013,A,No,0803,,
529,Extreme Markup Languages,Extreme,CORE2013,C,No,0803,,
541,Formal Methods in Software Engineering and Defence Systems Workshop,FMSEDS,CORE2013,C,No,0803,,
545,Foundations of Aspect-Oriented Languages,FOAL,CORE2013,C,No,0803,,
547,Foundations of Software Science and Computational Structures,FOSSACS,CORE2013,C,Yes,0803,,
553,Functional and Declarative Programming in Education,FDPE,CORE2013,C,No,0803,,
554,Fundamental Approaches to Software Engineering,FASE,CORE2013,B,Yes,0803,,
565,"GI International Conference on Detection of Intrusions and Malware, and Vulnerability Assessment",DIMVA,CORE2013,C,Yes,0803,,
574,Haskell Workshop,HASKELL,CORE2013,C,No,0803,,
596,IEEE Bioinformatics and Bioengineering,BIBE,CORE2013,C,No,0803,,
597,IEEE Computational Systems Bioinformatics Conference,CSB,CORE2013,A,No,0803,,
599,IEEE Computer Security Foundations Symposium (was CSFW),CSF,CORE2013,A,Yes,0803,,
640,IEEE International Conference on COTS-Based Software Systems,ICCBSS,CORE2013,C,No,0803,,
650,IEEE International Conference on Global Software Engineering,ICGSE,CORE2013,C,No,0803,,
658,IEEE International Conference on Intelligence and Security Informatics,ISI,CORE2013,C,No,0803,,
676,"IEEE International Conference on Software Maintenance and Evolution (prior to 2014 was ICSM, IEEE International Conference on Software Maintenance)",ICSME,CORE2013,A,Yes,0803,,
687,IEEE International On-Line Testing Symposium,IOLTS,CORE2013,C,No,0803,,
690,IEEE International Requirements Engineering Conference,RE,CORE2013,A,No,0803,,
698,IEEE International Symposium on High Assurance Systems Engineering,HASE,CORE2013,B,No,0803,,
705,IEEE International Symposium on Performance Analysis of Systems and Software,ISPASS,CORE2013,C,Yes,0803,,
707,IEEE International Symposium on Security in Networks and Distributed Systems,SSNDS,CORE2013,C,No,0803,,
718,IEEE International Workshop on Source Code Analysis and Manipulation,SCAM,CORE2013,C,No,0803,,
726,IEEE Software Engineering Workshop,SEW,CORE2013,C,No,0803,,
743,IEEE Symposium on Computer Arithmetic,ARITH,CORE2013,C,No,0803,,
749,IEEE International Symposium on Rapid System Prototyping (was IEEE Symposium on Rapid Prototyping),RSP,CORE2013,C,No,0803,,
761,IEEE Working Conference on Reverse Engineering,WCRE,CORE2013,B,No,0803,,
787,IEEE/IFIP International Conference on Dependable Systems and Networks,DSN,CORE2013,A*,Yes,0803,,
791,International Conference on Software Architecture (was previously WICSA),ICSA,CORE2013,A,Yes,0803,,
796,IFAC Conference on System Structure and Control,SSSC,CORE2013,C,No,0803,,
805,"IFIP Joint International Conference on Formal Description Techniques and Protocol Specification, Testing, And Verification",FORTE,CORE2013,A,Yes,0803,,
811,IFIP/ACM Working Conference on Component Deployment,CD,CORE2013,B,No,0803,,
816,IMA International Conference on Cryptography and Coding,IMACC,CORE2013,B,No,0803,0804,
825,Information Security Practice and Experience Conference,ISPEC,CORE2013,B,No,0803,,
826,Information Security Symposium,CERIAS,CORE2013,C,No,0803,,
847,Intelligent Systems in Molecular Biology,ISMB,CORE2013,A,No,0803,,
871,International Computer Software and Applications Conference,COMPSAC,CORE2013,B,No,0803,,
882,"International Conference Abstract State Machines, Alloy, B, TLA, VDM, and Z (Previously International Conference of B and Z Users, ZB, changed in 2008)",ABZ,CORE2013,C,No,0803,,
907,International Conference on Applied Cryptography and Network Security,ACNS,CORE2013,B,No,0803,,
921,International Conference on Advanced and Trusted Computing (was International Conference on Autonomic and Trusted Computing),ATC,CORE2013,C,No,0803,,
923,"International Conference on Availability, Reliability and Security",ARES,CORE2013,B,No,0803,,
934,International Conference on Communication System Software and Middleware,COMSWARE,CORE2013,C,No,0803,,
936,International Conference on Compiler Construction,CC,CORE2013,A,No,0803,,
945,International Conference on Computational Intelligence and Security,CIS,CORE2013,C,No,0803,,
961,"International Conference on Computer Safety, Reliability and Security",SAFECOMP,CORE2013,B,No,0803,,
980,International Conference on Coordination Models and Languages,Coordination,CORE2013,A,Yes,0803,,
982,International Conference on Cryptology and Network Security,CANS,CORE2013,B,No,0803,,
991,International Conference on Dependability of Computer Systems,DEPCoS,CORE2013,C,No,0803,,
992,"International Conference on Dependable, Autonomic and Secure Computing",DASC,CORE2013,C,No,0803,,
1022,International Conference on Evaluation and Assessment in Software Engineering,EASE,CORE2013,A,Yes,0803,,
1023,International Conference on Evaluation of Novel Approaches to Software Engineering,ENASE,CORE2013,B,No,0803,,
