33,ACM International Symposium on High Performance Distributed Computing,HPDC,CORE2013,A,No,0805,,
45,"ACM SIGMOBILE International Conference on Mobile Systems, Applications and Services",Mobisys,CORE2013,B,No,0805,,
63,ACM Symposium on Principles of Distributed Computing,PODC,CORE2013,A*,No,0805,,
77,"International Conference for High Performance Computing, Networking, Storage and Analysis (was Supercomputing Conference)",SC,CORE2013,A,No,0805,,
78,ACM SIGSIM Conference on Principles of Advanced Discrete Simulation (was Parallel and Distributed Simulation),PADS,CORE2013,B,No,0805,,
91,Advanced Research in VLSI,ARVLSI,CORE2013,C,No,0805,,
142,Application of Concurrency to System Design,ACSD,CORE2013,B,No,0805,,
165,Web and Big Data,APWEB,CORE2013,C,Yes,0805,,
169,Asian International Mobile Computing Conference,AMOC,CORE2013,C,No,0805,,
184,Asia-Pacific Network Operations and Management Symposium,APNOMS,CORE2013,C,No,0805,,
185,Asia-Pacific Services Computing Conference,APSCC,CORE2013,C,Yes,0805,,
214,Australasian Conference on Parallel and Real-Time Systems,APRTS,CORE2013,Australasian,Yes,0805,,
230,Australasian Symposium on Grid Computing and e-Research (now AusPDC),AusGrid,CORE2013,Australasian,Yes,0805,,
231,Australasian Symposium on Parallel and Distributed Computing (was AusGrid),AusPDC,CORE2013,Australasian,Yes,0805,,
267,Australian Supercomputing Conference,ACS,CORE2013,Australasian,Yes,0805,,
278,Australian World Wide Web Conference,AusWeb,CORE2013,Australasian,Yes,0805,,
310,Challenges of Large Applications in Distributed Environments,CLADE,CORE2013,C,No,0805,,
357,Conference on Algorithms and Hardware for Parallel Processing,CONPAR,CORE2013,C,No,0805,,
449,Enabling Grids for E-Science European Conference,EGEE,CORE2013,C,No,0805,,
465,"Euromicro International Conference on Parallel, Distributed and Network Based Processing",PDP,CORE2013,C,No,0805,,
496,European Conference on Universal Multiservice Networks,ECUMN,CORE2013,C,No,0805,,
505,European MPI Users' Group Conference,EuroMPI,CORE2013,C,No,0805,,
579,Heterogeneity in Computing Workshop,HCW,CORE2013,B,No,0805,,
581,High-Performance Grid Computing Workshop (part of IPDPS Conference),HPGrid,CORE2013,C,No,0805,,
616,IEEE Consumer Communications and Networking Conference,IEEE CCNC,CORE2013,B,No,0805,,
620,IEEE Global Internet Symposium,GI,CORE2013,C,No,0805,,
630,IEEE International Conference on Autonomic Computing,ICAC,CORE2013,B,No,0805,,
632,IEEE International Conference on Cluster Computing,CLUSTER,CORE2013,A,No,0805,,
644,IEEE International Conference on Distributed Computing in Sensor Systems,DCOSS,CORE2013,B,No,0805,,
648,IEEE International Conference on e-Science and Grid Computing,e-Science,CORE2013,A,No,0805,,
652,IEEE International Conference on High Performance Computing and Communications,HPCC,CORE2013,B,No,0805,,
653,IEEE International Conference on High Performance Computing and Simulation,IEEE HPCS,CORE2013,B,No,0805,,
667,IEEE International Conference on Parallel Processing Workshops,WoPP,CORE2013,C,No,0805,,
669,IEEE International Conference on Pervasive Computing and Communications,PERCOM,CORE2013,A*,No,0805,,
680,IEEE International Conference on Wireless Information Technology and Systems,ICWITS,CORE2013,B,No,0805,,
688,IEEE International Parallel and Distributed Processing Symposium (was IPPS and SPDP),IPDPS,CORE2013,A,Yes,0805,,
689,IEEE International Performance Computing and Communications Conference,IPCCC,CORE2013,B,No,0805,,
695,"IEEE International Symposium on Cluster, Cloud and Grid Computing",CCGRID,CORE2013,A,No,0805,,
696,International Symposium on Distributed Simulation and Real Time Applications,DS-RT,CORE2013,B,No,0805,0806,
702,IEEE International Symposium on Network Computing and Applications,NCA,CORE2013,A,No,0805,,
703,IEEE International Symposium on Real-Time Distributed Computing,ISORC,CORE2013,C,No,0805,,
704,IEEE International Symposium on Parallel and Distributed Processing with Applications,ISPA,CORE2013,B,Yes,0805,,
714,IEEE International Workshop on Future Trends of Distributed Computing Systems,FTDCS,CORE2013,C,No,0805,,
717,IEEE International Workshop on Quality of Service,IWQoS,CORE2013,B,No,0805,,
746,IEEE Symposium on High-Performance Interconnects,HOTI,CORE2013,B,No,0805,,
784,IEEE/ACM International Conference on Grid Computing,GRID,CORE2013,A,No,0805,,
801,IFIP International Conference on Distributed Applications and Interoperable Systems,DAIS,CORE2013,B,No,0805,,
802,IFIP International Conference on Open Distributed Processing,ODP,CORE2013,B,No,0805,,
810,IFIP?International Conference on Network and Parallel Computing,NPC,CORE2013,C,No,0805,,
813,International Conference on Network and Service Management (amalgamation of DSOM and related workshops from 2010),CNSM,CORE2013,B,No,0805,,
873,International Conference and Exhibition on High Performance Computing in the Asia-Pacific Region,HPC Asia,CORE2013,B,Yes,0805,,
887,International Conference on Advanced Computing and Communications,AdCom,CORE2013,B,No,0805,,
890,International Conference on Advanced Information Networking and Applications (was ICOIN),AINA,CORE2013,B,No,0805,,
899,International Conference on Advances in Mobile Computing and Multimedia,MOMM,CORE2013,B,No,0805,1203,
905,International Conference on Algorithms and Architectures for Parallel Processing,ICA3PP,CORE2013,B,No,0805,,
908,"International Conference on Application-specific Systems, Architectures and Processors",ASAP,CORE2013,A,No,0805,,
935,International Conference on Communications in Computing,CIC,CORE2013,C,No,0805,,
939,"International Conference on Complex, Intelligent and Software Intensive Systems",CISIS,CORE2013,C,No,0805,,
1000,International Conference on Distributed Computing and Internet Technologies,ICDCIT,CORE2013,C,No,0805,,
1001,International Conference on Distributed Computing and Networking,ICDCN,CORE2013,B,No,0805,,
1002,International Conference on Distributed Computing Systems,ICDCS,CORE2013,A,No,0805,,
1003,International Conference on Distributed Frameworks for Multimedia Applications,DFMA,CORE2013,C,No,0805,,
1043,International Conference on Grid and Cooperative Computing,GCC,CORE2013,C,No,0805,,
1044,"International Conference on Green, Pervasive and Cloud Computing (was Grid and Pervasive Computing)",GPC,CORE2013,C,No,0805,,
1045,International Conference on Grid Computing and Applications,GCA,CORE2013,C,No,0805,,
1046,"International Conference on Grid computing, high-performance and Distributed Applications",GADA,CORE2013,C,No,0805,,
1048,International Conference on High Performance Computing,HiPC,CORE2013,A,Yes,0805,,
1049,"International Conference on High Performance Computing, Networking and Communication Systems",HPCNCS,CORE2013,B,No,0805,1006,
1050,International Conference on High Performance Scientific Computing,HPSC,CORE2013,C,No,0805,,
1052,International Conference on High-Performance Clustered Computing (International Conference on Linux Clusters),LCI,CORE2013,C,No,0805,,
1094,International Conference on Intelligent Pervasive Computing,IPC,CORE2013,C,No,0805,,
1106,International Conference on Internet Computing in Science and Engineering,ICICSE,CORE2013,C,Yes,0805,,
1127,International Conference on Massively Parallel Computing Systems,MPCS,CORE2013,B,No,0805,,
1131,International Conference on Mobile and Ubiquitous Systems: Networks and Services,Mobiquitous,CORE2013,A,No,0805,,
1132,International Conference on Mobile Business,ICMB,CORE2013,C,No,0805,,
1134,"International Conference on Mobile Ubiquitous Computing, Systems, Services and Technologies",UBICOMM,CORE2013,C,Yes,0805,,
1148,International Conference on Networked Computing,INC,CORE2013,C,No,0805,,
1162,"International Conference on Parallel and Distributed Computing, Applications and Technologies",PDCAT,CORE2013,B,Yes,0805,,
1163,International Conference on Parallel and Distributed Processing Techniques and Applications,PDPTA,CORE2013,B,No,0805,,
1164,International Conference on Parallel and Distributed Systems,ICPADS,CORE2013,B,No,0805,,
1165,International Conference on Parallel Architecture and Compilation Techniques,PACT,CORE2013,A,No,0805,,
1167,International Conference on Parallel Processing,ICPP,CORE2013,A,Yes,0805,,
1168,International Conference on Parallel Processing and Applied Mathematics,PPAM,CORE2013,C,No,0805,,
1171,International Conference on Pervasive Computing (Joined with UbiComp from 2013),PERVASIVE,CORE2013,A*,No,0805,1203,
1172,International Conference on Pervasive Computing and Applications,ICPCA,CORE2013,C,No,0805,,
1173,International Conference on Pervasive Services,ICPS,CORE2013,C,No,0805,,
1177,International Conference on Principles of Distributed Systems,OPODIS,CORE2013,B,No,0805,,
1204,International Conference on Service Oriented Computing,ICSOC,CORE2013,A,No,0805,,
1260,"International Meeting on High Performance Computing for Computational Science (previously International Meeting Vector and Parallel Processing, changed in 2002)",VECPAR,CORE2013,B,No,0805,,
1271,International Conference on Web Information Systems Engineering,WISE,CORE2013,A,Yes,0805,,
1330,International Parallel Computing Workshop,PCW,CORE2013,C,No,0805,,
1340,ISC High Performance (was International Supercomputing Conference),ISC,CORE2013,C,No,0805,,
1359,International Symposium on Autonomous Decentralized Systems,ISADS,CORE2013,C,No,0805,,
1363,International Symposium on Collaborative Technologies and Systems,CTS,CORE2013,C,No,0805,,
1370,International Symposium on Computer Architecture and High Performance Computing,SBAC-PAD,CORE2013,B,No,0805,,
1374,International Symposium on Distributed Computing (was WDAG),DISC,CORE2013,A,No,0805,,
1385,International Symposium on Grids and Clouds (was International Symposium on Grid Computing),ISGC,CORE2013,C,No,0805,,
1405,International Symposium on Parallel and Distributed Computing,ISPDC,CORE2013,C,No,0805,,
1406,"International Symposium on Parallel Architectures, Algorithms and Networks",I-SPAN,CORE2013,B,No,0805,,
1425,International Symposium on the Mathematical Theory of Networks and Systems,MTNS,CORE2013,C,No,0805,,
1486,International workshop on High-Level Parallel Programming and Applications,HLPP,CORE2013,C,No,0805,,
1487,International Workshop on High-Level Parallel Programming Models and Supportive Environments,HIPS,CORE2013,C,No,0805,,
1489,International Workshop on Hot topics in Peer-to-Peer Systems,HotP2P,CORE2013,C,No,0805,,
1501,International Workshop on Middleware for Grid Computing,MGC,CORE2013,C,No,0805,,
1530,International Workshop on Software Engineering for High Performance Computing Applications,SE-HPC,CORE2013,C,No,0805,,
1548,International World Wide Web Conference,WWW,CORE2013,A*,Yes,0805,0806,0807
1603,Massively Parallel Processing Using Optional Interconnections,MPPOI,CORE2013,B,No,0805,,
1662,Pacific Rim International Symposium on Dependable Computing,PRDC,CORE2013,B,No,0805,,
1673,Parallel and Distributed Information Systems,PDIS,CORE2013,C,No,0805,,
1674,Parallel Computing,PARCO,CORE2013,C,No,0805,,
1691,Principles and Practice of Parallel Programming,PPoPP,CORE2013,A,No,0805,,
1769,Summer School on Modelling and Verification of Parallel Processes,MOVEP,CORE2013,C,No,0805,,
1782,"Symposium on Design, Analysis, and Simulation of Distributed Systems",DASD,CORE2013,C,No,0805,,
1789,"Symposium on Networked Systems, Design and Implementation",NSDI,CORE2013,B,No,0805,,
1790,Symposium on Parallelism in Algorithms and Architectures,SPAA,CORE2013,A,No,0805,,
1792,Symposium on Reliable Distributed Systems,SRDS,CORE2013,A,No,0805,,
1794,"Symposium on Stabilization, Safety, and Security of Distributed Systems",SSS,CORE2013,C,No,0805,,
1802,Testbeds and Research Infrastructures for the Development of Networks and Communities,TridentCom,CORE2013,B,Yes,0805,,
1807,The International Conference on Semantic Web and Web Services,SWWS,CORE2013,C,No,0805,,
1868,Workshop on Ad Hoc and Ubiquitous computing,AUC,CORE2013,C,No,0805,,
1892,Workshop on Computer Architecture Education,WCAE,CORE2013,C,No,0805,,
1909,Workshop on Job Scheduling Strategies for Parallel Processing,JSSPP,CORE2013,B,No,0805,,
1914,Workshop on Mobile Computing Systems and Applications,HOTMOBILE,CORE2013,C,No,0805,,
1916,Workshop on Nature Inspired Distributed Computing,NISDIC,CORE2013,C,No,0805,,
1935,Workshop on Service Oriented Computing,SOCASE,CORE2013,C,No,0805,,
2038,International Conference on Computer Communication and Networks,ICCCN,CORE2013,A,No,0805,,
2093,Symposium on Frontiers of Massively Parallel Processing,MassPar,CORE2013,A,No,0805,,
2105,Network Storage Symposium,NetStore,CORE2013,A,No,0805,,
2110,IEEE Conference on Open Architecture and Network Programming,OPENARCH,CORE2013,A,No,0805,,
2144,Unix Symposium on Internet Technologies,USITS,CORE2013,A,No,0805,,
8,Accounting and Finance Association of Australia and New Zealand Conference,AFAANZ,CORE2013,Australasian,Yes,0806,,
13,ACM Conference on Computer Supported Cooperative Work,CSCW,CORE2013,A,No,0806,,
14,ACM Conference on Economics and Computation,EC,CORE2013,B,Yes,0806,,
22,ACM International Conference on Advances in Geographic Information Systems,SIGSPATIAL,CORE2013,B,Yes,0806,,
23,"ACM International Conference on Advances in Computer Entertainment (merged with DIMEA, Digital Interactive Media in Entertainment and Arts, in 2009)",ACE,CORE2013,B,No,0806,1203,
25,ACM International Conference on Information and Knowledge Management,CIKM,CORE2013,A,Yes,0806,0807,
28,ACM International Conference on Recommender Systems,RecSys,CORE2013,B,Yes,0806,,
29,ACM International Conference on Research and Development in Information Retrieval,SIGIR,CORE2013,A*,Yes,0806,0807,
40,ACM SIGCHI_NZ Conference on Human-Computer Interaction,SIGCHI-NZ,CORE2013,Australasian\,No,0806,,
57,ACM Special Interest Group on Supporting Group Work (was SIGGRoup),Group,CORE2013,B,No,0806,,
66,ACM Symposium on User Interface Software and Technology,UIST,CORE2013,A,No,0806,,
74,ACM Workshop on Web Information and Data Management,WIDM,CORE2013,B,No,0806,,
83,ACM SIGMIS Computers and People Research,ACM-SIGMIS CPR,CORE2013,B,No,0806,,
95,Advances in Information Systems,ADVIS,CORE2013,C,No,0806,,
115,Americas Conference on Information Systems,AMCIS,CORE2013,A,No,0806,,
122,Annual Conference of the International Academy for Information Management,IAIM,CORE2013,C,No,0806,,
133,Annual Meeting of the Decision Sciences Institute,DSI,CORE2013,C,No,0806,,
135,Annual PPIG Workshop,PPIG,CORE2013,B,No,0806,,
139,AoM Organizational Communication and Information Systems,OCIS,CORE2013,A,No,0806,,
144,Applications of Natural Language to Data Bases,NLDB,CORE2013,C,No,0806,,
156,Asia Information Retrieval Symposium,AIRS,CORE2013,C,Yes,0806,0807,
164,Asia Pacific Research Symposium on Accounting Information Systems,APRSAIS,CORE2013,C,No,0806,,
201,Australasia Conference on Information Security and Privacy,AISP,CORE2013,Australasian,Yes,0806,,
213,Australasian Conference on Information Systems,ACIS,CORE2013,Australasian,Yes,0806,,
233,Australasian Urban and Regional Information Systems Association Conference,AURISA,CORE2013,Australasian,Yes,0806,,
234,Australasian User Interface Conference,AUIC,CORE2013,Australasian,Yes,0806,,
241,Australian and New Zealand Academy of Management Conference,ANZAM,CORE2013,Australasian,Yes,0806,,
244,Australian and New Zealand Intelligent Information Systems Conference,ANZIIS,CORE2013,Australasian,Yes,0806,,
245,Australian and New Zealand Marketing Academy Conference,ANZMAC,CORE2013,Australasian,Yes,0806,,
247,Australian Computer Human Interaction Conference,OZCHI,CORE2013,Australasian,Yes,0806,1203,
256,Australian Game Developers Conference,AGDC,CORE2013,Australasian,Yes,0806,,
259,Australian Information Warfare and Security Conference,WarSec,CORE2013,Australasian,Yes,0806,,
261,Australian Institute of Computer Ethics Conference,AICE,CORE2013,Australasian,Yes,0806,,
274,"Australian Workshop on Mobile Computing, Databases and Applications",MCDA,CORE2013,Australasian,Yes,0806,,
288,Body Sensor Networks,BSN,CORE2013,C,No,0806,,
294,British Computer Society Conference on Human-Computer Interaction,HCI,CORE2013,National,Yes,0806,,
317,Collaborative Electronic Commerce Technology and Research,CollECTeR,CORE2013,B,No,0806,,
337,Computer Supported Collaborative Learning,CSCL,CORE2013,A*,Yes,0806,,
356,Conference on Algorithmic Aspects in Information and Management,AAIM,CORE2013,C,No,0806,,
367,"Conference on Information Science, Technology and Management",CISTM,CORE2013,B,No,0806,,
368,Conference on Information Sciences and Systems,CISS,CORE2013,C,No,0806,,
369,Conference on Innovative Data Systems Research,CIDR,CORE2013,A,No,0806,,
372,Conference on Office Information Systems,SIGOA,CORE2013,C,No,0806,,
404,Cultural Attitudes towards Technology and Communications,CATAC,CORE2013,B,No,0806,,
409,Data Semantics in Web Information Systems,DASWIS,CORE2013,C,No,0806,,
418,Design for User Experience,DUX,CORE2013,B,No,0806,1203,
422,Designing Interactive Systems,DIS,CORE2013,B,No,0806,1203,
426,Digital Arts and Culture,DAC,CORE2013,C,No,0806,,
427,Digital Games Research Conference,DIGRA,CORE2013,C,No,0806,,
433,Distributed Communities on the Web Workshop,Dcw,CORE2013,C,No,0806,,
456,Ershov Conference,PSI,CORE2013,B,No,0806,,
457,ETHICOMP Conference,ETHICOMP,CORE2013,B,No,0806,,
471,European Conference of Information Warfare,ECIW,CORE2013,C,No,0806,,
478,European Conference on Computer Supported Cooperative Work,ECSCW,CORE2013,B,No,0806,,
480,European Conference on Digital Government (was European Conference on e-Government ECEG),ECDG,CORE2013,C,Yes,0806,,
482,European Conference on Information Management and Evaluation,ECIME,CORE2013,C,No,0806,,
483,European Conference on Information Retrieval,ECIR,CORE2013,B,Yes,0806,0807,
484,European Conference on Information Systems,ECIS,CORE2013,A,No,0806,,
485,European Conference on Knowledge Management,EKM,CORE2013,B,No,0806,,
492,European Conference on Research Methodology for Business and Management Studies,ECRM,CORE2013,C,No,0806,,
503,European Natural Language Generation Workshop,EuroNLG,CORE2013,B,No,0806,,
510,European SPI,EuroSPI,CORE2013,B,Yes,0806,,
523,"European, Mediterranean and Middle Eastern Conference on Information Systems",EMCIS,CORE2013,B,No,0806,,
527,Exploring Modelling Methods in Systems Analysis and Design,EMMSAD,CORE2013,C,No,0806,,
555,Game Developers Conference,GDC,CORE2013,C,No,0806,,
566,GIS Planet Conference,GISPlanet,CORE2013,C,No,0806,,
569,Global Information Technology Management Association World Conference,GITMA,CORE2013,B,No,0806,,
575,Hawaii International Conference on System Sciences,HICSS,CORE2013,A,No,0806,,
576,Health Informatics Conference,HIC,CORE2013,Australasian,Yes,0806,,
584,Human System Interaction,HSI,CORE2013,C,No,0806,,
606,IEEE Conference on Electronic Commerce Technology (merger of CEC and EEE),CEC,CORE2013,C,No,0806,,
611,"IEEE Conference on Systems, Man and Cybernetics",SMC,CORE2013,B,No,0806,,
615,IEEE Congress on Services,SERVICES,CORE2013,B,No,0806,,
618,IEEE European Conference on Web Services,ECOWS,CORE2013,C,No,0806,,
624,IEEE International Augmented Reality Toolkit Workshop,IARTW,CORE2013,C,No,0806,,
631,IEEE International Conference on Cloud Computing,CLOUD,CORE2013,B,No,0806,,
643,IEEE International Conference on Digital EcoSystems and Technologies Conference,IEEE DEST,CORE2013,C,No,0806,,
647,"IEEE International Conference on Enterprise Computing, E-Commerce and E-Services",EEE,CORE2013,C,No,0806,,
668,IEEE International Conference on Peer to Peer Computing,P2P,CORE2013,C,No,0806,,
673,IEEE International Conference on Service-Oriented Computing and Applications,SOCA,CORE2013,C,No,0806,,
674,IEEE International Conference on Services Computing,SCC,CORE2013,A,No,0806,,
678,IEEE International Conference on Web Services,ICWS,CORE2013,A,No,0806,,
682,IEEE International Enterprise Distributed Object Computing Conference,EDOC,CORE2013,B,No,0806,,
708,IEEE International Symposium on Wearable Computers,ISWC,CORE2013,A*,No,0806,,
709,IEEE International Symposium on Web Systems Evolution,WSE,CORE2013,C,No,0806,,
729,IEEE Symposium on Advanced Management of Information for Globalized Enterprises,AMIGE,CORE2013,C,No,0806,,
752,IEEE Symposium on Visual Languages and Human-Centric Computing (was VL),VL/HCC,CORE2013,A,Yes,0806,,
772,IEEE Workshop on Hot Topics in Web Systems and Technologies,HotWeb,CORE2013,B,No,0806,,
788,IEEE/IFIP International Conference on Embedded and Ubiquitous Computing,EUC,CORE2013,C,No,0806,,
807,IFIP TC13 Conference on Human-Computer Interaction,Interact,CORE2013,A,Yes,0806,1203,
809,IFIP Working Conferences on Virtual Enterprises,PRO-VE,CORE2013,C,No,0806,,
820,Industrial Simulation Conference,ISC,CORE2013,C,No,0806,,
822,Information Integration and Web-based Applications and Services,IIWAS,CORE2013,C,No,0806,,
827,Information Security Conference,ISC,CORE2013,C,Yes,0806,,
828,Information Systems Education Conference,ISECON,CORE2013,B,No,0806,,
837,International Conference on Innovations for Community Services (was Innovative Internet Computer Systems IICS until 2014),I4CS,CORE2013,C,No,0806,,
838,Institute for Small Business and Entrepreneurship Annual Conference,ISBE,CORE2013,C,No,0806,,
850,Interaction,Interaction,CORE2013,C,No,0806,,
862,International Business Information Management,IBIMA,CORE2013,B,No,0806,,
878,International Conference in Business Process Management,BPM,CORE2013,A,No,0806,,
880,International Conference of Society for Group Decision and Negotiation,GDN,CORE2013,B,No,0806,,
889,International Conference on Advanced Information Management,IMS,CORE2013,C,No,0806,,
891,International Conference on Advanced Information Systems Engineering,CaiSE,CORE2013,A,No,0806,,
892,International Conference on Advanced Language Processing and Web Information Technology,ALPIT,CORE2013,C,No,0806,,
895,International Conference on Advances in Computer-Human Interactions,ACHI,CORE2013,C,No,0806,,
896,"International Conference on Advances in Infrastructure for Electronic Business, Science, and Education on the Internet",SSGRR,CORE2013,C,No,0806,,
926,International Conference on Business Information Systems,BIS,CORE2013,B,No,0806,,
931,IEEE International Conference on Cloud Computing Technology and Science (International Conference on Cloud Computing pre 2010),CloudCom,CORE2013,C,No,0806,,
933,"International Conference on Collaborative Computing: Networks, Applications and Worksharing",CollaborateCom,CORE2013,C,No,0806,,
960,International Conference on Computer Information Systems and Industrial Management Applications,CISIM,CORE2013,C,No,0806,,
962,International Conference on Computer Supported Cooperative Work in Design,CSCWD,CORE2013,B,No,0806,1203,
970,International Conference on Computing and Informatics,ICOCI,CORE2013,C,No,0806,,
979,International Conference on Cooperative Information Systems,CoopIS,CORE2013,A,No,0806,,
981,International Conference on Creating Connecting and Collaborating through Computing,C5,CORE2013,C,No,0806,,
993,International Conference on Design Science Research in Information Systems and Technology,DESRIST,CORE2013,A,No,0806,,
995,"International Conference on Digital Content, Multimedia Technology and its Applications",IDC,CORE2013,C,No,0806,,
996,International Conference on Digital Government Research,DGO,CORE2013,B,No,0806,,
1005,International Conference on e-Business,ICEB,CORE2013,B,No,0806,,
1006,International Conference on Electronic Commerce,ICEC,CORE2013,C,No,0806,,
1007,International Conference on Electronic Commerce and Web Technology,ECWeb,CORE2013,B,No,0806,,
1009,International Conference on Email and Anti-Spam,CEAS,CORE2013,B,No,0806,,
1016,International Conference on Enterprise Information Systems,ICEIS,CORE2013,C,No,0806,,
1017,International Conference on Enterprise Information Systems and Web Technologies,EISWT,CORE2013,C,No,0806,,
1018,International Conference on Enterprise Integration and Modelling Technology,ICEIMT,CORE2013,C,No,0806,,
1019,International Conference on Entertainment Computing,ICEC,CORE2013,C,No,0806,,
1033,International Conference on Formal Ontology in Information Systems,FOIS,CORE2013,A,Yes,0806,,
1047,International Conference on Health Informatics,Healthinf,CORE2013,C,No,0806,,
1053,International Conference on Human Factors in Computing Systems,CHI,CORE2013,A*,No,0806,1203,
1054,International Conference on Human-Computer Interaction with Mobile Devices and Services,MobileHCI,CORE2013,B,No,0806,,
1065,International Conference on Informatics Education and Research,AIS SIGED: IAIM,CORE2013,B,Yes,0806,,
1067,International Conference on Information and Communication Technologies in Tourism,ENTER,CORE2013,C,No,0806,,
1073,International Conference on Information Processing and Management of Uncertainty,IPMU,CORE2013,C,Yes,0806,,
1074,International Conference on Information Resources Management,Conf-IRM,CORE2013,B,No,0806,,
1078,International Conference on Information Systems,ICIS,CORE2013,A*,Yes,0806,,
1079,International Conference on Information Systems Analysis and Synthesis,ISAS,CORE2013,C,No,0806,,
1080,International Conference on Information Systems Development,ISD,CORE2013,A,No,0806,,
1082,International Conference on Information Systems Technology and its Application,ISTA,CORE2013,B,No,0806,,
1088,"International Conference on Information, Communications and Signal Processing",ICICS,CORE2013,B,No,0806,,
1091,"International Conference on Intelligent Agents, Web Technologies, and Internet Commerce",IAWTIC,CORE2013,B,No,0806,,
1101,International Conference on Intelligent User Interfaces,IUI,CORE2013,A,Yes,0806,,
1102,"International Conference on Interaction Sciences: Information Technology, Culture and Human",ICIS,CORE2013,C,No,0806,,
